"Project","ScanDate","DependencyName","DependencyPath","Description","License","Md5","Sha1","Identifiers","CPE","CVE","CWE","Vulnerability","Source","CVSSv2_Severity","CVSSv2_Score","CVSSv2","CVSSv3_BaseSeverity","CVSSv3_BaseScore","CVSSv3","CVSSv4_BaseSeverity","CVSSv4_BaseScore","CVSSv4","CPE Confidence","Evidence Count","VendorProject","Product","Name","DateAdded","ShortDescription","RequiredAction","DueDate","Notes"
customer-service,"Fri, 26 Dec 2025 14:15:04 +0100",tomcat-embed-core-10.1.33.jar,/home/srozange/.m2/repository/org/apache/tomcat/embed/tomcat-embed-core/10.1.33/tomcat-embed-core-10.1.33.jar,Core Tomcat implementation,"Apache License, Version 2.0: http://www.apache.org/licenses/LICENSE-2.0.txt",48ee7e18b3dd003d03189906ace0b413,d4d10b953164db057e4a803506e4552731e5a6a0,pkg:maven/org.apache.tomcat.embed/tomcat-embed-core@10.1.33,"cpe:2.3:a:apache:tomcat:10.1.33:*:*:*:*:*:*:*, cpe:2.3:a:apache_tomcat:apache_tomcat:10.1.33:*:*:*:*:*:*:*",CVE-2025-53506,CWE-400 Uncontrolled Resource Consumption,"Uncontrolled Resource Consumption vulnerability in Apache Tomcat if an HTTP/2 client did not acknowledge the initial settings frame that reduces the maximum permitted concurrent streams.  This issue affects Apache Tomcat: from 11.0.0-M1 through 11.0.8, from 10.1.0-M1 through 10.1.42, from 9.0.0.M1 through 9.0.106. The following versions were EOL at the time the CVE was created but are  known to be affected: 8.5.0 through 8.5.100. Other EOL versions may also be affected.   Users are recommended to upgrade to version 11.0.9, 10.1.43 or 9.0.107, which fix the issue.",NVD,"","","",HIGH,7.5,CVSS:3.1/AV:N/AC:L/PR:N/UI:N/S:U/C:N/I:N/A:H/E:3.9/RC:R/MAV:A,"","","",HIGH,63,"","","","","","","",""
customer-service,"Fri, 26 Dec 2025 14:15:04 +0100",tomcat-embed-core-10.1.33.jar,/home/srozange/.m2/repository/org/apache/tomcat/embed/tomcat-embed-core/10.1.33/tomcat-embed-core-10.1.33.jar,Core Tomcat implementation,"Apache License, Version 2.0: http://www.apache.org/licenses/LICENSE-2.0.txt",48ee7e18b3dd003d03189906ace0b413,d4d10b953164db057e4a803506e4552731e5a6a0,pkg:maven/org.apache.tomcat.embed/tomcat-embed-core@10.1.33,"cpe:2.3:a:apache:tomcat:10.1.33:*:*:*:*:*:*:*, cpe:2.3:a:apache_tomcat:apache_tomcat:10.1.33:*:*:*:*:*:*:*",CVE-2025-55752,CWE-23 Relative Path Traversal,"Relative Path Traversal vulnerability in Apache Tomcat.  The fix for bug 60013 introduced a regression where the       rewritten URL was normalized before it was decoded. This introduced the       possibility that, for rewrite rules that rewrite query parameters to the       URL, an attacker could manipulate the request URI to bypass security       constraints including the protection for /WEB-INF/ and /META-INF/. If PUT requests were also enabled then malicious files could be uploaded leading to remote code execution. PUT requests are normally limited to trusted users and it is considered unlikely that PUT requests would be enabled in conjunction with a rewrite that manipulated the URI.    This issue affects Apache Tomcat: from 11.0.0-M1 through 11.0.10, from 10.1.0-M1 through 10.1.44, from 9.0.0.M11 through 9.0.108.  The following versions were EOL at the time the CVE was created but are  known to be affected: 8.5.6 though 8.5.100. Other, older, EOL versions may also be affected. Users are recommended to upgrade to version 11.0.11 or later, 10.1.45 or later or 9.0.109 or later, which fix the issue.",NVD,"","","",HIGH,7.5,CVSS:3.1/AV:N/AC:H/PR:L/UI:N/S:U/C:H/I:H/A:H/E:1.6/RC:R/MAV:A,"","","",HIGH,63,"","","","","","","",""
customer-service,"Fri, 26 Dec 2025 14:15:04 +0100",tomcat-embed-core-10.1.33.jar,/home/srozange/.m2/repository/org/apache/tomcat/embed/tomcat-embed-core/10.1.33/tomcat-embed-core-10.1.33.jar,Core Tomcat implementation,"Apache License, Version 2.0: http://www.apache.org/licenses/LICENSE-2.0.txt",48ee7e18b3dd003d03189906ace0b413,d4d10b953164db057e4a803506e4552731e5a6a0,pkg:maven/org.apache.tomcat.embed/tomcat-embed-core@10.1.33,"cpe:2.3:a:apache:tomcat:10.1.33:*:*:*:*:*:*:*, cpe:2.3:a:apache_tomcat:apache_tomcat:10.1.33:*:*:*:*:*:*:*",CVE-2025-46701,CWE-178 Improper Handling of Case Sensitivity,"Improper Handling of Case Sensitivity vulnerability in Apache Tomcat's GCI servlet allows security constraint bypass of security constraints that apply to the pathInfo component of a URI mapped to the CGI servlet.  This issue affects Apache Tomcat: from 11.0.0-M1 through 11.0.6, from 10.1.0-M1 through 10.1.40, from 9.0.0.M1 through 9.0.104. The following versions were EOL at the time the CVE was created but are  known to be affected: 8.5.0 though 8.5.100. Other, older, EOL versions  may also be affected.   Users are recommended to upgrade to version 11.0.7, 10.1.41 or 9.0.105, which fixes the issue.",NVD,"","","",HIGH,7.3,CVSS:3.1/AV:N/AC:L/PR:N/UI:N/S:U/C:L/I:L/A:L/E:3.9/RC:R/MAV:A,"","","",HIGH,63,"","","","","","","",""
customer-service,"Fri, 26 Dec 2025 14:15:04 +0100",tomcat-embed-core-10.1.33.jar,/home/srozange/.m2/repository/org/apache/tomcat/embed/tomcat-embed-core/10.1.33/tomcat-embed-core-10.1.33.jar,Core Tomcat implementation,"Apache License, Version 2.0: http://www.apache.org/licenses/LICENSE-2.0.txt",48ee7e18b3dd003d03189906ace0b413,d4d10b953164db057e4a803506e4552731e5a6a0,pkg:maven/org.apache.tomcat.embed/tomcat-embed-core@10.1.33,"cpe:2.3:a:apache:tomcat:10.1.33:*:*:*:*:*:*:*, cpe:2.3:a:apache_tomcat:apache_tomcat:10.1.33:*:*:*:*:*:*:*",CVE-2025-55668,CWE-384 Session Fixation,"Session Fixation vulnerability in Apache Tomcat via rewrite valve.  This issue affects Apache Tomcat: from 11.0.0-M1 through 11.0.7, from 10.1.0-M1 through 10.1.41, from 9.0.0.M1 through 9.0.105. Older, EOL versions may also be affected.  Users are recommended to upgrade to version 11.0.8, 10.1.42 or 9.0.106, which fix the issue.",NVD,"","","",MEDIUM,6.5,CVSS:3.1/AV:N/AC:L/PR:N/UI:R/S:U/C:H/I:N/A:N/E:2.8/RC:R/MAV:A,"","","",HIGH,63,"","","","","","","",""
customer-service,"Fri, 26 Dec 2025 14:15:04 +0100",tomcat-embed-core-10.1.33.jar,/home/srozange/.m2/repository/org/apache/tomcat/embed/tomcat-embed-core/10.1.33/tomcat-embed-core-10.1.33.jar,Core Tomcat implementation,"Apache License, Version 2.0: http://www.apache.org/licenses/LICENSE-2.0.txt",48ee7e18b3dd003d03189906ace0b413,d4d10b953164db057e4a803506e4552731e5a6a0,pkg:maven/org.apache.tomcat.embed/tomcat-embed-core@10.1.33,"cpe:2.3:a:apache:tomcat:10.1.33:*:*:*:*:*:*:*, cpe:2.3:a:apache_tomcat:apache_tomcat:10.1.33:*:*:*:*:*:*:*",CVE-2024-54677,CWE-400 Uncontrolled Resource Consumption,"Uncontrolled Resource Consumption vulnerability in the examples web application provided with Apache Tomcat leads to denial of service.  This issue affects Apache Tomcat: from 11.0.0-M1 through 11.0.1, from 10.1.0-M1 through 10.1.33, from 9.0.0.M1 through 9.9.97. The following versions were EOL at the time the CVE was created but are  known to be affected: 8.5.0 though 8.5.100. Other, older, EOL versions  may also be affected.   Users are recommended to upgrade to version 11.0.2, 10.1.34 or 9.0.98, which fixes the issue.",NVD,"","","",MEDIUM,5.3,CVSS:3.1/AV:N/AC:L/PR:N/UI:N/S:U/C:N/I:N/A:L/E:3.9/RC:R/MAV:A,"","","",HIGH,63,"","","","","","","",""
customer-service,"Fri, 26 Dec 2025 14:15:04 +0100",tomcat-embed-core-10.1.33.jar,/home/srozange/.m2/repository/org/apache/tomcat/embed/tomcat-embed-core/10.1.33/tomcat-embed-core-10.1.33.jar,Core Tomcat implementation,"Apache License, Version 2.0: http://www.apache.org/licenses/LICENSE-2.0.txt",48ee7e18b3dd003d03189906ace0b413,d4d10b953164db057e4a803506e4552731e5a6a0,pkg:maven/org.apache.tomcat.embed/tomcat-embed-core@10.1.33,"cpe:2.3:a:apache:tomcat:10.1.33:*:*:*:*:*:*:*, cpe:2.3:a:apache_tomcat:apache_tomcat:10.1.33:*:*:*:*:*:*:*",CVE-2025-61795,CWE-404 Improper Resource Shutdown or Release,"Improper Resource Shutdown or Release vulnerability in Apache Tomcat.  If an error occurred (including exceeding limits) during the processing of a multipart upload, temporary copies of the uploaded parts written to disc were not cleaned up immediately but left for the garbage collection process to delete. Depending on JVM settings, application memory usage and application load, it was possible that space for the temporary copies of uploaded parts would be filled faster than GC cleared it, leading to a DoS.    This issue affects Apache Tomcat: from 11.0.0-M1 through 11.0.11, from 10.1.0-M1 through 10.1.46, from 9.0.0.M1 through 9.0.109.  The following versions were EOL at the time the CVE was created but are  known to be affected: 8.5.0 though 8.5.100. Other, older, EOL versions may also be affected. Users are recommended to upgrade to version 11.0.12 or later, 10.1.47 or later or 9.0.110 or later which fixes the issue.",NVD,"","","",MEDIUM,5.3,CVSS:3.1/AV:N/AC:H/PR:L/UI:N/S:U/C:N/I:N/A:H/E:1.6/RC:R/MAV:A,"","","",HIGH,63,"","","","","","","",""
